{
  "$schema": "https://json-schema.org/draft/2020-12/schema",
  "$id": "https://shoti.github.io/news/schema/briefing-1.0.json",
  "title": "Shoti Daily News Briefing",
  "type": "object",
  "additionalProperties": false,
  "required": [
    "schema_version",
    "briefing_id",
    "edition_date",
    "timezone",
    "revision",
    "corrects_revision",
    "generated_at",
    "coverage",
    "introduction",
    "takeaways",
    "coverage_note",
    "stories"
  ],
  "properties": {
    "schema_version": { "const": "1.0" },
    "briefing_id": { "type": "string", "pattern": "^[a-z0-9]+(?:-[a-z0-9]+)*$", "minLength": 3, "maxLength": 80 },
    "edition_date": { "type": "string", "format": "date" },
    "timezone": { "const": "Asia/Tbilisi" },
    "revision": { "type": "integer", "minimum": 1 },
    "corrects_revision": { "type": ["integer", "null"], "minimum": 1 },
    "generated_at": { "$ref": "#/$defs/timestamp" },
    "coverage": {
      "type": "object",
      "additionalProperties": false,
      "required": ["start", "end"],
      "properties": {
        "start": { "$ref": "#/$defs/timestamp" },
        "end": { "$ref": "#/$defs/timestamp" }
      }
    },
    "introduction": { "type": "string", "minLength": 20, "maxLength": 1000 },
    "takeaways": {
      "type": "array",
      "minItems": 1,
      "maxItems": 5,
      "items": { "type": "string", "minLength": 5, "maxLength": 350 }
    },
    "coverage_note": {
      "oneOf": [
        { "type": "null" },
        { "type": "string", "minLength": 10, "maxLength": 1000 }
      ]
    },
    "stories": {
      "type": "array",
      "minItems": 1,
      "maxItems": 10,
      "items": { "$ref": "#/$defs/story" }
    }
  },
  "$defs": {
    "timestamp": {
      "type": "string",
      "format": "date-time",
      "pattern": "^\\d{4}-\\d{2}-\\d{2}T\\d{2}:\\d{2}:\\d{2}(?:\\.\\d{1,3})?(?:Z|[+-]\\d{2}:\\d{2})$"
    },
    "nullableTimestamp": {
      "oneOf": [
        { "type": "null" },
        { "$ref": "#/$defs/timestamp" }
      ]
    },
    "story": {
      "type": "object",
      "additionalProperties": false,
      "required": [
        "id",
        "category",
        "importance",
        "headline",
        "summary",
        "why_it_matters",
        "uncertainty",
        "event_at",
        "sources"
      ],
      "properties": {
        "id": { "type": "string", "pattern": "^[a-z0-9]+(?:-[a-z0-9]+)*$", "minLength": 3, "maxLength": 80 },
        "category": {
          "type": "string",
          "pattern": "^[a-z0-9]+(?:-[a-z0-9]+)*$",
          "minLength": 2,
          "maxLength": 50
        },
        "importance": { "type": "integer", "minimum": 1, "maximum": 10 },
        "headline": { "type": "string", "minLength": 8, "maxLength": 240 },
        "summary": { "type": "string", "minLength": 20, "maxLength": 1600 },
        "why_it_matters": { "type": "string", "minLength": 20, "maxLength": 1200 },
        "uncertainty": {
          "oneOf": [
            { "type": "null" },
            { "type": "string", "minLength": 10, "maxLength": 800 }
          ]
        },
        "event_at": { "$ref": "#/$defs/nullableTimestamp" },
        "sources": {
          "type": "array",
          "minItems": 1,
          "maxItems": 8,
          "items": { "$ref": "#/$defs/source" }
        }
      }
    },
    "source": {
      "type": "object",
      "additionalProperties": false,
      "required": ["id", "publisher", "title", "url", "published_at", "supports"],
      "properties": {
        "id": { "type": "string", "pattern": "^[a-z0-9]+(?:-[a-z0-9]+)*$", "minLength": 1, "maxLength": 40 },
        "publisher": { "type": "string", "minLength": 1, "maxLength": 120 },
        "title": { "type": "string", "minLength": 1, "maxLength": 300 },
        "url": { "type": "string", "format": "uri", "pattern": "^https://" },
        "published_at": { "$ref": "#/$defs/nullableTimestamp" },
        "supports": {
          "type": "array",
          "minItems": 1,
          "maxItems": 3,
          "uniqueItems": true,
          "items": { "enum": ["summary", "why_it_matters", "uncertainty"] }
        }
      }
    }
  }
}
