{
  "schema_version": "1.0",
  "briefing_id": "example-2026-09-20-evening",
  "edition_date": "2026-09-20",
  "timezone": "Asia/Tbilisi",
  "revision": 1,
  "corrects_revision": null,
  "generated_at": "2026-09-20T20:12:00+04:00",
  "coverage": {
    "start": "2026-09-19T20:00:00+04:00",
    "end": "2026-09-20T20:00:00+04:00"
  },
  "introduction": "ეს არის მხოლოდ გამოგონილი ტექნიკური მაგალითი, რომელიც სქემისა და იმპორტის შესამოწმებლად გამოიყენება.",
  "takeaways": [
    "მაგალითის ყველა ამბავი და წყარო გამოგონილია და არ წარმოადგენს რეალურ ახალ ამბავს."
  ],
  "coverage_note": "ფიქციური fixture — არ გამოაქვეყნოთ როგორც ნამდვილი საინფორმაციო გამოშვება.",
  "stories": [
    {
      "id": "fictional-public-service-update",
      "category": "georgia-politics",
      "importance": 1,
      "headline": "ფიქციური საჯარო სერვისის განახლება მხოლოდ განლაგების შესამოწმებლად",
      "summary": "გამოგონილმა უწყებამ გამოაქვეყნა გამოგონილი ცვლილება, რათა გრძელი ქართული სათაური და ტექსტი საიტის ტესტებში გამოიცადოს.",
      "why_it_matters": "ეს ტექსტი ამოწმებს, რომ პრაქტიკული კონტექსტი, წყაროს ბმული და ქართული ტიპოგრაფია სწორად გამოჩნდება.",
      "uncertainty": "ეს ამბავი მთლიანად გამოგონილია და ფაქტობრივ ინფორმაციად არ უნდა იქნას აღქმული.",
      "event_at": null,
      "sources": [
        {
          "id": "example-source",
          "publisher": "Example News — ფიქციური",
          "title": "Fictional source used only for software testing",
          "url": "https://example.com/fictional-news-fixture",
          "published_at": null,
          "supports": ["summary", "why_it_matters", "uncertainty"]
        }
      ]
    }
  ]
}
